Citance Number,Reference Article,Citing Article,Citation Marker Offset,Citation Marker,Citation Offset,Citation Text,Citation Text Clean,Reference Offset,Reference Text,Discourse Facet
1,P08-1102,C08-1049,0,2008,0,"Following Jiang et al (2008), we describe segmentation and Joint S& amp; T as below: For a given Chinese sentence appearing as a character sequence: C 1: n= C 1 C 2.","Following Jiang et al (2008), we describe segmentation and Joint S& amp; T as below: For a given Chinese sentence appearing as a character sequence: C 1: n= C 1 C 2.",'9',"<S sid=""9"" ssid=""5"">To segment and tag a character sequence, there are two strategies to choose: performing POS tagging following segmentation; or joint segmentation and POS tagging (Joint S&amp;T).</S>",['method_citation']
2,P08-1102,C08-1049,0,2008,0,"As described in Ng and Low (2004 )andJiang et al (2008), we use s indicating a single character word, while b, m and e indicating the be gin, middle and end of a word respectively","As described in Ng and Low (2004) and Jiang et al (2008), we use s indicating a single character word, while b, m and e indicating the be gin, middle and end of a word respectively",'25',"<S sid=""25"" ssid=""21"">According to Ng and Low (2004), the segmentation task can be transformed to a tagging problem by assigning each character a boundary tag of the following four types: We can extract segmentation result by splitting the labelled result into subsequences of pattern s or bm*e which denote single-character word and multicharacter word respectively.</S>",['method_citation']
3,P08-1102,C08-1049,0,2008,0,plates called lexical-target in the column below areintroduced by Jiang et al (2008),plates called lexical-target in the column below are introduced by Jiang et al (2008),'38',"<S sid=""38"" ssid=""10"">Templates immediately borrowed from Ng and Low (2004) are listed in the upper column named non-lexical-target.</S>",['method_citation']
4,P08-1102,P12-1110,0,2008,0,"For CTB-5, we refer to the split by Duan et al (2007) as CTB-5d, and to the split by Jiang et al (2008) as CTB-5j","For CTB-5, we refer to the split by Duan et al (2007) as CTB-5d, and to the split by Jiang et al (2008) as CTB-5j",'4',"<S sid=""4"" ssid=""4"">On the Penn Chinese Treebank 5.0, we obtain an error reduction of segmentation and joint segmentation and part-of-speech tagging over the perceptron-only baseline.</S>",['method_citation']
5,P08-1102,D12-1126,0,2008,0,Jiang et al (2008) proposes a cascaded linear model for joint Chinese word segmentation and POS tagging,Jiang et al (2008) proposes a cascaded linear model for joint Chinese word segmentation and POS tagging,"'1','0','130'","<S sid=""1"" ssid=""1"">We propose a cascaded linear model for joint Chinese word segmentation and partof-speech tagging.</S><S sid=""0"">A Cascaded Linear Model for Joint Chinese Word Segmentation and Part-of-Speech Tagging</S><S sid=""130"" ssid=""1"">We proposed a cascaded linear model for Chinese Joint S&amp;T.</S>",['method_citation']
6,P08-1102,C10-1135,0,2008,0,"We use the feature templates the same as Jiang et al, (2008) to extract features form E model","We use the feature templates the same as Jiang et al, (2008) to extract features form E model",'14',"<S sid=""14"" ssid=""10"">As a result, many theoretically useful features such as higherorder word or POS n-grams are difficult to be incorporated in the model efficiently.</S>",['method_citation']
8,P08-1102,P12-1025,0,"Jiangetal., 2008a",0,"approach, where basic processing units are characters which compose words (Jiangetal., 2008a)","basic processing units are characters which compose words (Jiangetal., 2008a)",'27',"<S sid=""27"" ssid=""23"">As each tag is now composed of a boundary part and a POS part, the joint S&amp;T problem is transformed to a uniform boundary-POS labelling problem.</S>",['method_citation']
9,P08-1102,C10-2096,0,2008b,0,"The solid lines show the 1-best result, which is wrong. Jiang et al (2008b) stress the problems in re ranking phase","The solid lines show the 1-best result, which is wrong. Jiang et al (2008b) stress the problems in re ranking phase",'124',"<S sid=""124"" ssid=""35"">The generating model, which functions as that in HMM, brings an improvement of about 0.1 points to each test item.</S>",['method_citation']
10,P08-1102,C10-2096,0,"Jiang et al, 2008a",0,"6.1.1 Baseline Forest-based System We first segment the Chinese sentences into the1-best segmentations using a state-of-the-art system (Jiang et al, 2008a), since it is not necessary for a conventional parser to take as input the POS tagging results","We first segment the Chinese sentences into the 1-best segmentations using a state-of-the-art system (Jiang et al, 2008a), since it is not necessary for a conventional parser to take as input the POS tagging results",'48',"<S sid=""48"" ssid=""20"">We used the algorithm depicted in Algorithm 1 to tune the parameter vector a.</S>",['method_citation']
11,P08-1102,C10-2096,0,"Jiang et al, 2008a",0,"6.1.2 Lattice-forest SystemWe first segment and POS tag the Chinese sentences into word lattices using the same system (Jiang et al, 2008a), and prune each lattice into a reasonable size using the marginal probability-based pruning algorithm","We first segment and POS tag the Chinese sentences into word lattices using the same system (Jiang et al, 2008a), and prune each lattice into a reasonable size using the marginal probability-based pruning algorithm",'48',"<S sid=""48"" ssid=""20"">We used the algorithm depicted in Algorithm 1 to tune the parameter vector a.</S>","['method_citation','results_citation']"
12,P08-1102,C10-1132,0,"Jiang et al, 2008",0,"However, when we repeat the work of (Jiang et al, 2008), which reports to achieve the state-of-art performance in the data-sets that we adopt, it has been found that some features (e.g., C0) are unnoticeably trained several times in their model (which are implicitly generated from different feature templates used in the paper)","However, when we repeat the work of (Jiang et al, 2008), which reports to achieve the state-of-art performance in the data-sets that we adopt, it has been found that some features (e.g., C0) are unnoticeably trained several times in their model (which are implicitly generated from different feature templates used in the paper)",'90',"<S sid=""90"" ssid=""1"">We reported results from two set of experiments.</S>",['method_citation']
13,P08-1102,C10-1132,0,"Jiang et al, 2008",0,"Unicode/CP936 1.1M/55K 104K/13K 0.035 Table 3: Corpus statistics for the second SIGHAN Bakeoff appears twice, which is generated from two different templates Cn (with n=0, generates C0) and [C0Cn] (used in (Jiang et al, 2008), with n=0, generates [C0C0])","Table 3: Corpus statistics for the second SIGHAN Bakeoff appears twice, which is generated from two different templates Cn (with n=0, generates C0) and [C0Cn] (used in (Jiang et al, 2008), with n=0, generates [C0C0])",'110',"<S sid=""110"" ssid=""21"">Similar trend appeared in experiments of Ng and Low (2004), where they conducted experiments on CTB 3.0 and achieved Fmeasure 0.919 on Joint S&amp;T, a ratio of 96% to the F-measure 0.952 on segmentation.</S>",['method_citation']
14,P08-1102,C10-1132,0,"Jiang et al, 2008",0,"As all the features adopted in (Jiang et al, 2008) possess binary values, if a binary feature is repeated n times, then it should behave like a real-valued feature with its value to be? n?, at least in principle","As all the features adopted in (Jiang et al, 2008) possess binary values, if a binary feature is repeated n times, then it should behave like a real-valued feature with its value to be n, at least in principle",'14',"<S sid=""14"" ssid=""10"">As a result, many theoretically useful features such as higherorder word or POS n-grams are difficult to be incorporated in the model efficiently.</S>",['method_citation']
15,P08-1102,C10-1132,0,"Jiang et al, 2008",0,"Inspired by (Jiang et al, 2008), we set the real d Although Table 5 has shown that the proposed all the value of C0 to be 2.0, the value of C-1C0anC0C1 to be 3.0, and the values of all other features to be 1.0 for the character-based discriminative-plus model","Inspired by (Jiang et al, 2008), we set the real d Although Table 5 has shown that the proposed all the value of C0 to be 2.0, the value of C-1C0anC0C1 to be 3.0, and the values of all other features to be 1.0 for the character-based discriminative-plus model",'79',"<S sid=""79"" ssid=""4"">By maintaining a stack of size N at each position i of the sequence, we can preserve the top N best candidate labelled results of subsequence C1:i during decoding.</S>",['method_citation']
17,P08-1102,C10-1132,0,"Jiang et al, 2008",0,"Last, (Jiang et al, 2008) 5 adds repeated features implicitly based on (Ng and Low, 2004)","Last, (Jiang et al, 2008) 5 adds repeated features implicitly based on (Ng and Low, 2004)",'4',"<S sid=""4"" ssid=""4"">On the Penn Chinese Treebank 5.0, we obtain an error reduction of segmentation and joint segmentation and part-of-speech tagging over the perceptron-only baseline.</S>",['method_citation']
20,P08-1102,D12-1046,0,Jiang et al2008a,0,"Previous joint models mainly focus on word segmentation and POS tagging task, such as the virtual nodes method (Qian et al2010), cascaded linear model (Jiang et al2008a) ,perceptron (Zhang and Clark, 2008), sub-word based stacked learning (Sun, 2011), re ranking (Jiang et al2008b)","Previous joint models mainly focus on word segmentation and POS tagging task, such as the virtual nodes method (Qian et al2010), cascaded linear model (Jiang et al2008a), perceptron (Zhang and Clark, 2008), sub-word based stacked learning (Sun, 2011), re ranking (Jiang et al2008b)",'0',"<S sid=""0"">A Cascaded Linear Model for Joint Chinese Word Segmentation and Part-of-Speech Tagging</S>",['method_citation']
