Citance Number,Reference Article,Citing Article,Citation Marker Offset,Citation Marker,Citation Offset,Citation Text,Citation Text Clean,Reference Offset,Reference Text,Discourse Facet
1,P87-1015,P01-1018,0,1987,0,"The approach that Vijay-Shanker et al (1987) and Weir (1988) take, elaborated on by Becker et al (1992), is to identify a very general class of formalisms, which they call linear context free rewriting systems (CFRSs), and define for this class a large space of structural descriptions which serves as a common ground in which the strong generative capacities of these formalisms can be compared","The approach that Vijay-Shanker et al (1987) and Weir (1988) take, elaborated on by Becker et al (1992), is to identify a very general class of formalisms, which they call linear context free rewriting systems (CFRSs), and define for this class a large space of structural descriptions which serves as a common ground in which the strong generative capacities of these formalisms can be compared","'92','117'","<S sid=""92"" ssid=""77"">We loosely describe the class of all such systems as Linear Context-Free Rewriting Formalisms.</S><S sid=""117"" ssid=""2"">Our goal is to define a class of formal systems, and show that any member of this class will possess certain attractive properties.</S>","['hypothesis_citation','results_citation']"
2,P87-1015,E09-1055,0,"Vijay-Shanker et al, 1987",0,"Here we use the standard definition of LCFRS (Vijay-Shanker et al, 1987) and only fix our notation; for a more thorough discussion of this formal ism, we refer to the literature. Let G be an LCFRS","Here we use the standard definition of LCFRS (Vijay-Shanker et al, 1987) and only fix our notation; for a more thorough discussion of this formal ism, we refer to the literature. Let G be an LCFRS",'159',"<S sid=""159"" ssid=""44"">Similarly, for all the LCFRS's, discussed in Section 2, we can define the relationship between a structure and the sequence of substrings it spans, and the effect of the composition operations on sequences of substrings.</S>",['method_citation']
3,P87-1015,W07-2214,0,"Vijay-Shanker et al, 1987",0,"There are many (structural) mildly context sensitive grammar formalisms ,e.g .mcfg ,lcfrs, mg, and they have been shown to be equivalent (Vijay-Shanker et al., 1987)","There are many (structural) mildly context sensitive grammar formalisms ,e.g .mcfg ,lcfrs, mg, and they have been shown to be equivalent (Vijay-Shanker et al., 1987)",'62',"<S sid=""62"" ssid=""47"">TAG's can be shown to be equivalent to this restricted system.</S>",['method_citation']
4,P87-1015,P09-2003,0,,0,"They are in particular more powerful than linear context-free rewriting systems (LCFRS) (Vijay-Shanker et al, 1987)","They are in particular more powerful than linear context-free rewriting systems (LCFRS) (Vijay-Shanker et al, 1987)","'92','134'","<S sid=""92"" ssid=""77"">We loosely describe the class of all such systems as Linear Context-Free Rewriting Formalisms.</S><S sid=""134"" ssid=""19"">These systems are similar to those described by Pollard (1984) as Generalized Context-Free Grammars (GCFG's).</S>","['hypothesis_citation','method_citation']"
5,P87-1015,P09-1111,0,"Vijay-Shanker et al, 1987",0,"Following this line, (Vijay-Shanker et al, 1987) have introduced a formalism called linear context-free rewriting systems (LCFRSs) that has received much attention in later years by the community","Following this line, (Vijay-Shanker et al, 1987) have introduced a formalism called linear context-free rewriting systems (LCFRSs) that has received much attention in later years by the community","'207','92'","<S sid=""207"" ssid=""13"">We outlined the definition of a family of constrained grammatical formalisms, called Linear Context-Free Rewriting Systems.</S><S sid=""92"" ssid=""77"">We loosely describe the class of all such systems as Linear Context-Free Rewriting Formalisms.</S>","['hypothesis_citation','method_citation']"
6,P87-1015,P09-1111,0,"Vijay-Shanker et al, 1987",0,"We briefly summarize here the terminology and notation that we adopt for LCFRS; for detailed definitions, see (Vijay-Shanker et al, 1987)","We briefly summarize here the terminology and notation that we adopt for LCFRS; for detailed definitions, see (Vijay-Shanker et al, 1987)",'2',"<S sid=""2"" ssid=""2"">In considering the relationship between formalisms, we show that it is useful to abstract away from the details of the formalism, and examine the nature of their derivation process as reflected by properties their trees. find that several of the formalisms considered can be seen as being closely related since they have derivation tree sets with the same structure as those produced by Context-Free Grammars On the basis of this observation, we describe a class of formalisms which we call Linear Context- Free Rewriting Systems, and show they are recognizable in polynomial time and generate only semilinear languages.</S>","['hypothesis_citation','results_citation']"
7,P87-1015,P07-1021,0,"Vijay-Shanker et al, 1987",0,"We write REGD.k/ to refer to the class of regular dependency languages with a gap-degree bounded by k. Linear Context-Free Rewriting Systems Gap-restricted dependency languages are closely related to Linear Context-Free Rewriting Systems (lcfrs) (Vijay-Shanker et al, 1987), a class of formal systems that generalizes several mildly context-sensitive grammar formalisms","Linear Context-Free Rewriting Systems Gap-restricted dependency languages are closely related to Linear Context-Free Rewriting Systems (lcfrs) (Vijay-Shanker et al, 1987), a class of formal systems that generalizes several mildly context-sensitive grammar formalisms","'92','207','134'","<S sid=""92"" ssid=""77"">We loosely describe the class of all such systems as Linear Context-Free Rewriting Formalisms.</S><S sid=""207"" ssid=""13"">We outlined the definition of a family of constrained grammatical formalisms, called Linear Context-Free Rewriting Systems.</S><S sid=""134"" ssid=""19"">These systems are similar to those described by Pollard (1984) as Generalized Context-Free Grammars (GCFG's).</S>","['hypothesis_citation','method_citation']"
8,P87-1015,N09-1061,0,"Vijay-Shanker et al, 1987",0,"This observation is in line with empirical studies in the context of dependency parsing, where the need for formalisms with higher fan-out has been observed even in standard, single language texts (Kuhlmann and Nivre, 2006) .In this paper, we present an algorithm that computes optimal decompositions of rules in the formalism of Linear Context-Free Rewriting Systems (LCFRS) (Vijay-Shanker et al, 1987)","This observation is in line with empirical studies in the context of dependency parsing, where the need for formalisms with higher fan-out has been observed even in standard, single language texts (Kuhlmann and Nivre, 2006). In this paper, we present an algorithm that computes optimal decompositions of rules in the formalism of Linear Context-Free Rewriting Systems (LCFRS) (Vijay-Shanker et al, 1987)",'92',"<S sid=""92"" ssid=""77"">We loosely describe the class of all such systems as Linear Context-Free Rewriting Formalisms.</S>","['hypothesis_citation','method_citation']"
9,P87-1015,N09-1061,0,1987,0,"We briefly summarize the terminology and notation that we adopt for LCFRS; for detailed definitions, see Vijay-Shanker et al (1987)","We briefly summarize the terminology and notation that we adopt for LCFRS; for detailed definitions, see Vijay-Shanker et al (1987)",'122',"<S sid=""122"" ssid=""7"">These operations, as we see below, are restricted to be size preserving (as in the case of concatenation in CFG) which implies that they will be linear and non-erasing.</S>",['method_citation']
10,P87-1015,W10-1407,0,"Vijay-Shanker et al, 1987",0,"LCFRS (Vijay-Shanker et al, 1987) are anatural extension of CFG in which a single nonterminal node can dominate more than one continuous span of terminals","LCFRS (Vijay-Shanker et al, 1987) are a natural extension of CFG in which a single nonterminal node can dominate more than one continuous span of terminals",'192',"<S sid=""192"" ssid=""77"">Thus, the ATM has no more than 6km&amp;quot; + 1 work tapes, where km&amp;quot; is the maximum number of substrings spanned by a derived structure.</S>",['implication_citation']
11,P87-1015,W10-1407,0,"Vijay-Shanker et al, 1987",0,"A LCFRS (Vijay-Shanker et al, 1987) is a tuple G= (N, T, V, P, S )wherea) N is a finite set of non-terminals with a function dim: N? N that determines the fan-out of each A? N; b) T and V are disjoint finite sets of terminals and variables; c) S? N is the start symbol with dim (S)= 1; d) P is a finite set of rewriting rules A (? 1,..","A LCFRS (Vijay-Shanker et al, 1987) is a tuple G= (N, T, V, P, S ) where N is a finite set of non-terminals with a function dim: N? N that determines the fan-out of each A? N; b) T and V are disjoint finite sets of terminals and variables; c) S? N is the start symbol with dim (S)= 1; d) P is a finite set of rewriting rules A (? 1,..",'46',"<S sid=""46"" ssid=""31"">The following rule corresponds to the above derivation, where 71, , 7k are derived from the auxiliary trees , , fik, respectively. for all addresses n in some elementary tree at which 7' can be adjoined.</S>",['method_citation']
12,P87-1015,E09-1053,0,1987,0,"In particular, we cast new light on the relationship between CCG and other mildly context-sensitive formalisms such as Tree-Adjoining Grammar (TAG; Joshi and Schabes (1997)) and Linear Context-Free Rewrite Systems (LCFRS; Vijay-Shanker et al (1987))","In particular, we cast new light on the relationship between CCG and other mildly context-sensitive formalisms such as Tree-Adjoining Grammar (TAG; Joshi and Schabes (1997)) and Linear Context-Free Rewrite Systems (LCFRS; Vijay-Shanker et al (1987))","'207','134'","<S sid=""207"" ssid=""13"">We outlined the definition of a family of constrained grammatical formalisms, called Linear Context-Free Rewriting Systems.</S><S sid=""134"" ssid=""19"">These systems are similar to those described by Pollard (1984) as Generalized Context-Free Grammars (GCFG's).</S>","['hypothesis_citation','method_citation','results_citation']"
13,P87-1015,E09-1053,0,"Vijay-Shanker et al, 1987",0,"2 By this result, CCG falls in line with context-free grammars, TAG, and LCFRS, whose sets of deriva tional structures are all regular (Vijay-Shanker et al., 1987)","By this result, CCG falls in line with context-free grammars, TAG, and LCFRS, whose sets of derivational structures are all regular (Vijay-Shanker et al., 1987)",'50',"<S sid=""50"" ssid=""35"">The work of Rounds (1969) shows that the path sets of trees derived by IG's (like those of TAG's) are context-free languages.</S>",['results_citation']
14,P87-1015,E09-1053,0,"Vijay-Shanker et al, 1987",0,"It is important to note that while CCG derivations themselves can be seen as trees as well, they do not always form regular tree languages (Vijay-Shanker et al, 1987)","It is important to note that while CCG derivations themselves can be seen as trees as well, they do not always form regular tree languages (Vijay-Shanker et al, 1987)",'10',"<S sid=""10"" ssid=""8"">These two properties of the tree sets are not only linguistically relevant, but also have computational importance.</S>",['method_citation']
15,P87-1015,N10-1035,0,1987,0,"On this line of investigation, mildly context-sensitive grammar formalisms have been introduced (Joshi,1985), including, among several others, the tree ad joining grammars (TAGs) of Joshi et al (1975) .Linear context-free rewriting system (LCFRS), introduced by Vijay-Shanker et al (1987), is a mildly context-sensitive formalism that allows the derivation of tuples of strings ,i.e., discontinuous phrases","On this line of investigation, mildly context-sensitive grammar formalisms have been introduced (Joshi,1985), including, among several others, the tree ad joining grammars (TAGs) of Joshi et al (1975). Linear context-free rewriting system (LCFRS), introduced by Vijay-Shanker et al (1987), is a mildly context-sensitive formalism that allows the derivation of tuples of strings, i.e., discontinuous phrases","'27','74'","<S sid=""27"" ssid=""12"">Thus, the tree sets generated by HG's are similar to those of CFG's, with each node annotated by the operation (concatenation or wrapping) used to combine the headed strings derived by the daughters of Tree Adjoining Grammars, a tree rewriting formalism, was introduced by Joshi, Levy and Takahashi (1975) and Joshi (1983/85).</S><S sid=""74"" ssid=""59"">An extension of the TAG system was introduced by Joshi et al. (1975) and later redefined by Joshi (1987) in which the adjunction operation is defined on sets of elementary trees rather than single trees.</S>","['hypothesis_citation','method_citation','results_citation']"
16,P87-1015,P12-1053,0,1987,0,"CFTG are weakly equivalent to the simple macro grammars of Fischer (1968), which are a notational variant of the well-nested linear context-free rewriting systems (LCFRS) of Vijay-Shanker et al (1987) and the well-nested multiple context-free grammars (MCFG) of Seki et al (1991) .3 Thus, CFTG are mildly context-sensitive since their generated string languages are semi-linear and can be parsed in polynomial time (Go ?mez-Rodr? ?guez et al, 2010)","CFTG are weakly equivalent to the simple macro grammars of Fischer (1968), which are a notational variant of the well-nested linear context-free rewriting systems (LCFRS) of Vijay-Shanker et al (1987) and the well-nested multiple context-free grammars (MCFG) of Seki et al (1991)","'92','134'","<S sid=""92"" ssid=""77"">We loosely describe the class of all such systems as Linear Context-Free Rewriting Formalisms.</S><S sid=""134"" ssid=""19"">These systems are similar to those described by Pollard (1984) as Generalized Context-Free Grammars (GCFG's).</S>","['hypothesis_citation','method_citation']"
