Citance Number,Reference Article,Citing Article,Citation Marker Offset,Citation Marker,Citation Offset,Citation Text,Citation Text Clean,Reference Offset,Reference Text,Discourse Facet
1,P08-1102,C08-1049,0,2008,0,"Following Jiang et al (2008), we describe segmentation and Joint S& amp; T as below: For a given Chinese sentence appearing as a character sequence: C 1: n= C 1 C 2.","Following Jiang et al (2008), we describe segmentation and Joint S& amp; T as below: For a given Chinese sentence appearing as a character sequence: C 1: n= C 1 C 2.",'73',"<S sid=""73"" ssid=""24"">For instance, if the word w appears N times in training corpus and is labelled as POS t for n times, the probability Pr(t|w) can be estimated by the formula below: The probability Pr(w|t) could be estimated through the same approach.</S>",
2,P08-1102,C08-1049,0,2008,0,"As described in Ng and Low (2004 )andJiang et al (2008), we use s indicating a single character word, while b, m and e indicating the be gin, middle and end of a word respectively","As described in Ng and Low (2004) and Jiang et al (2008), we use s indicating a single character word, while b, m and e indicating the be gin, middle and end of a word respectively",'71',"<S sid=""71"" ssid=""22"">Using W = w1:m to denote the word sequence, T = t1:m to denote the corresponding POS sequence, P (T |W) to denote the probability that W is labelled as T, and P(W|T) to denote the probability that T generates W, we can define the cooccurrence model as follows: &#955;wt and &#955;tw denote the corresponding weights of the two components.</S>",
3,P08-1102,C08-1049,0,2008,0,plates called lexical-target in the column below areintroduced by Jiang et al (2008),plates called lexical-target in the column below are introduced by Jiang et al (2008),'49',"<S sid=""49"" ssid=""21"">To alleviate overfitting on the training examples, we use the refinement strategy called &#8220;averaged parameters&#8221; (Collins, 2002) to the algorithm in Algorithm 1.</S>",
4,P08-1102,P12-1110,0,2008,0,"For CTB-5, we refer to the split by Duan et al (2007) as CTB-5d, and to the split by Jiang et al (2008) as CTB-5j","For CTB-5, we refer to the split by Duan et al (2007) as CTB-5d, and to the split by Jiang et al (2008) as CTB-5j",'129',"<S sid=""129"" ssid=""40"">Experimental results show that, it achieves obvious improvement over the perceptron-only model, about from 0.973 to 0.978 on segmentation, and from 0.925 to 0.934 on Joint S&amp;T, with error reductions of 18.5% and 12% respectively.</S>",
5,P08-1102,D12-1126,0,2008,0,Jiang et al (2008) proposes a cascaded linear model for joint Chinese word segmentation and POS tagging,Jiang et al (2008) proposes a cascaded linear model for joint Chinese word segmentation and POS tagging,"'1','0'","<S sid=""1"" ssid=""1"">We propose a cascaded linear model for joint Chinese word segmentation and partof-speech tagging.</S><S sid=""0"">A Cascaded Linear Model for Joint Chinese Word Segmentation and Part-of-Speech Tagging</S>",
6,P08-1102,C10-1135,0,2008,0,"We use the feature templates the same as Jiang et al, (2008) to extract features form E model","We use the feature templates the same as Jiang et al, (2008) to extract features form E model",'25',"<S sid=""25"" ssid=""21"">According to Ng and Low (2004), the segmentation task can be transformed to a tagging problem by assigning each character a boundary tag of the following four types: We can extract segmentation result by splitting the labelled result into subsequences of pattern s or bm*e which denote single-character word and multicharacter word respectively.</S>",
8,P08-1102,P12-1025,0,"Jiangetal., 2008a",0,"approach, where basic processing units are characters which compose words (Jiangetal., 2008a)","basic processing units are characters which compose words (Jiangetal., 2008a)",'8',"<S sid=""8"" ssid=""4"">Another widely used discriminative method is the perceptron algorithm (Collins, 2002), which achieves comparable performance to CRFs with much faster training, so we base this work on the perceptron.</S>",
9,P08-1102,C10-2096,0,2008b,0,"The solid lines show the 1-best result, which is wrong. Jiang et al (2008b) stress the problems in re ranking phase","The solid lines show the 1-best result, which is wrong. Jiang et al (2008b) stress the problems in re ranking phase",'124',"<S sid=""124"" ssid=""35"">The generating model, which functions as that in HMM, brings an improvement of about 0.1 points to each test item.</S>",
10,P08-1102,C10-2096,0,"Jiang et al, 2008a",0,"6.1.1 Baseline Forest-based System We first segment the Chinese sentences into the1-best segmentations using a state-of-the-art system (Jiang et al, 2008a), since it is not necessary for a conventional parser to take as input the POS tagging results","We first segment the Chinese sentences into the 1-best segmentations using a state-of-the-art system (Jiang et al, 2008a), since it is not necessary for a conventional parser to take as input the POS tagging results",'10',"<S sid=""10"" ssid=""6"">Since the typical approach of discriminative models treats segmentation as a labelling problem by assigning each character a boundary tag (Xue and Shen, 2003), Joint S&amp;T can be conducted in a labelling fashion by expanding boundary tags to include POS information (Ng and Low, 2004).</S>",
11,P08-1102,C10-2096,0,"Jiang et al, 2008a",0,"6.1.2 Lattice-forest SystemWe first segment and POS tag the Chinese sentences into word lattices using the same system (Jiang et al, 2008a), and prune each lattice into a reasonable size using the marginal probability-based pruning algorithm","We first segment and POS tag the Chinese sentences into word lattices using the same system (Jiang et al, 2008a), and prune each lattice into a reasonable size using the marginal probability-based pruning algorithm",'48',"<S sid=""48"" ssid=""20"">We used the algorithm depicted in Algorithm 1 to tune the parameter vector a.</S>",
12,P08-1102,C10-1132,0,"Jiang et al, 2008",0,"However, when we repeat the work of (Jiang et al, 2008), which reports to achieve the state-of-art performance in the data-sets that we adopt, it has been found that some features (e.g., C0) are unnoticeably trained several times in their model (which are implicitly generated from different feature templates used in the paper)","However, when we repeat the work of (Jiang et al, 2008), which reports to achieve the state-of-art performance in the data-sets that we adopt, it has been found that some features (e.g., C0) are unnoticeably trained several times in their model (which are implicitly generated from different feature templates used in the paper)",'35',"<S sid=""35"" ssid=""7"">To compare with others conveniently, we excluded the ones forbidden by the close test regulation of SIGHAN, for example, Pu(C0), indicating whether character C0 is a punctuation.</S>",
13,P08-1102,C10-1132,0,"Jiang et al, 2008",0,"Unicode/CP936 1.1M/55K 104K/13K 0.035 Table 3: Corpus statistics for the second SIGHAN Bakeoff appears twice, which is generated from two different templates Cn (with n=0, generates C0) and [C0Cn] (used in (Jiang et al, 2008), with n=0, generates [C0C0])","Table 3: Corpus statistics for the second SIGHAN Bakeoff appears twice, which is generated from two different templates Cn (with n=0, generates C0) and [C0Cn] (used in (Jiang et al, 2008), with n=0, generates [C0C0])",'110',"<S sid=""110"" ssid=""21"">Similar trend appeared in experiments of Ng and Low (2004), where they conducted experiments on CTB 3.0 and achieved Fmeasure 0.919 on Joint S&amp;T, a ratio of 96% to the F-measure 0.952 on segmentation.</S>",
14,P08-1102,C10-1132,0,"Jiang et al, 2008",0,"As all the features adopted in (Jiang et al, 2008) possess binary values, if a binary feature is repeated n times, then it should behave like a real-valued feature with its value to be? n?, at least in principle","As all the features adopted in (Jiang et al, 2008) possess binary values, if a binary feature is repeated n times, then it should behave like a real-valued feature with its value to be n, at least in principle",'58',"<S sid=""58"" ssid=""9"">Instead of incorporating all features into the perceptron directly, we first trained the perceptron using character-based features, and several other sub-models using additional ones such as word or POS n-grams, then trained the outside-layer linear model using the outputs of these sub-models, including the perceptron.</S>",
15,P08-1102,C10-1132,0,"Jiang et al, 2008",0,"Inspired by (Jiang et al, 2008), we set the real d Although Table 5 has shown that the proposed all the value of C0 to be 2.0, the value of C-1C0anC0C1 to be 3.0, and the values of all other features to be 1.0 for the character-based discriminative-plus model","Inspired by (Jiang et al, 2008), we set the real d Although Table 5 has shown that the proposed all the value of C0 to be 2.0, the value of C-1C0anC0C1 to be 3.0, and the values of all other features to be 1.0 for the character-based discriminative-plus model",'79',"<S sid=""79"" ssid=""4"">By maintaining a stack of size N at each position i of the sequence, we can preserve the top N best candidate labelled results of subsequence C1:i during decoding.</S>",
17,P08-1102,C10-1132,0,"Jiang et al, 2008",0,"Last, (Jiang et al, 2008) 5 adds repeated features implicitly based on (Ng and Low, 2004)","Last, (Jiang et al, 2008) 5 adds repeated features implicitly based on (Ng and Low, 2004)",'4',"<S sid=""4"" ssid=""4"">On the Penn Chinese Treebank 5.0, we obtain an error reduction of segmentation and joint segmentation and part-of-speech tagging over the perceptron-only baseline.</S>",
20,P08-1102,D12-1046,0,Jiang et al2008a,0,"Previous joint models mainly focus on word segmentation and POS tagging task, such as the virtual nodes method (Qian et al2010), cascaded linear model (Jiang et al2008a) ,perceptron (Zhang and Clark, 2008), sub-word based stacked learning (Sun, 2011), re ranking (Jiang et al2008b)","Previous joint models mainly focus on word segmentation and POS tagging task, such as the virtual nodes method (Qian et al2010), cascaded linear model (Jiang et al2008a), perceptron (Zhang and Clark, 2008), sub-word based stacked learning (Sun, 2011), re ranking (Jiang et al2008b)",'0',"<S sid=""0"">A Cascaded Linear Model for Joint Chinese Word Segmentation and Part-of-Speech Tagging</S>",
