Citance Number,Reference Article,Citing Article,Citation Marker Offset,Citation Marker,Citation Offset,Citation Text,Citation Text Clean,Reference Offset,Reference Text,Discourse Facet
1,P08-1043,C10-1045,0,2008,0,"Finally, we note that simple weighting gives nearly a 2% F1 improvement, whereas Goldberg and Tsarfaty (2008) found that unweighted lattices were more effective for Hebrew","Finally, we note that simple weighting gives nearly a 2% F1 improvement, whereas Goldberg and Tsarfaty (2008) found that unweighted lattices were more effective for Hebrew",'8',"<S sid=""8"" ssid=""4"">The Hebrew token &#8216;bcl&#8217;1, for example, stands for the complete prepositional phrase 'We adopt here the transliteration of (Sima&#8217;an et al., 2001).</S>",
2,P08-1043,P11-1141,0,2008,0,Goldberg and Tsarfaty (2008) showed that a single model for morphological segmentation and syntactic parsing of Hebrew yielded an error reduction of 12% over the best pipelined models,Goldberg and Tsarfaty (2008) showed that a single model for morphological segmentation and syntactic parsing of Hebrew yielded an error reduction of 12% over the best pipelined models,'0',"<S sid=""0"">A Single Generative Model for Joint Morphological Segmentation and Syntactic Parsing</S>",
3,P08-1043,P10-1074,0,2008,0,"Zhang and Clark (2008) built a perceptron-based joint segmenter and part-of-speech (POS) tagger for Chinese, and Toutanova and Cherry (2009) learned a joint model of lemmatization and POS tagging which outperformed a pipelined model. Adler and Elhadad (2006) presented an HMMbased approach for unsupervised joint morphological segmentation and tagging of Hebrew, and Goldberg and Tsarfaty (2008) developed a joint model of segmentation, tagging and parsing of He brew, based on lattice parsing","Zhang and Clark (2008) built a perceptron-based joint segmenter and part-of-speech (POS) tagger for Chinese, and Toutanova and Cherry (2009) learned a joint model of lemmatization and POS tagging which outperformed a pipelined model. Adler and Elhadad (2006) presented an HMM-based approach for unsupervised joint morphological segmentation and tagging of Hebrew, and Goldberg and Tsarfaty (2008) developed a joint model of segmentation, tagging and parsing of Hebrew, based on lattice parsing",'188',"<S sid=""188"" ssid=""2"">The overall performance of our joint framework demonstrates that a probability distribution obtained over mere syntactic contexts using a Treebank grammar and a data-driven lexicon outperforms upper bounds proposed by previous joint disambiguation systems and achieves segmentation and parsing results on a par with state-of-the-art standalone applications results.</S>",
4,P08-1043,P11-1089,0,2008,0,Goldberg and Tsarfaty (2008) pro pose a generative joint model,Goldberg and Tsarfaty (2008) propose a generative joint model,'18',"<S sid=""18"" ssid=""14"">Cohen and Smith (2007) followed up on these results and proposed a system for joint inference of morphological and syntactic structures using factored models each designed and trained on its own.</S>",
5,P08-1043,W10-1404,0,2008,0,Goldberg and Tsarfaty (2008) concluded that an integrated model of morphological disambiguation and syntactic parsing in Hebrew Treebank parsing improves the results of a pipelined approach,Goldberg and Tsarfaty (2008) concluded that an integrated model of morphological disambiguation and syntactic parsing in Hebrew Treebank parsing improves the results of a pipelined approach,'0',"<S sid=""0"">A Single Generative Model for Joint Morphological Segmentation and Syntactic Parsing</S>",
6,P08-1043,P11-2124,0,2008,0,Goldberg and Tsarfaty (2008) demonstrated the effectiveness of lattice parsing for jointly performing segmentation and parsing of Hebrewtext,Goldberg and Tsarfaty (2008) demonstrated the effectiveness of lattice parsing for jointly performing segmentation and parsing of Hebrew text,'0',"<S sid=""0"">A Single Generative Model for Joint Morphological Segmentation and Syntactic Parsing</S>",
7,P08-1043,P11-2124,0,"Goldberg and Tsarfaty, 2008",0,"Following (Goldberg and Tsarfaty, 2008) we deal with the ambiguous affixation patterns in Hebrew by encoding the input sentence as a segmentation lattice","Following (Goldberg and Tsarfaty, 2008) we deal with the ambiguous affixation patterns in Hebrew by encoding the input sentence as a segmentation lattice",'29',"<S sid=""29"" ssid=""8"">A less canonical representation of segmental morphology is triggered by a morpho-phonological process of omitting the definite article h when occurring after the particles b or l. This process triggers ambiguity as for the definiteness status of Nouns following these particles.We refer to such cases in which the concatenation of elements does not strictly correspond to the original surface form as super-segmental morphology.</S>",
8,P08-1043,P12-2002,0,2008,0,2The complete set of analyses for this word is provided in Goldberg and Tsarfaty (2008),The complete set of analyses for this word is provided in Goldberg and Tsarfaty (2008),'12',"<S sid=""12"" ssid=""8"">This leads to word- and constituent-boundaries discrepancy, which breaks the assumptions underlying current state-of-the-art statistical parsers.</S>",
9,P08-1043,D12-1046,0,"Goldberg and Tsarfaty, 2008",0,"A study that is closely related toours is (Goldberg and Tsarfaty, 2008), where a single generative model was proposed for joint morphological segmentation and syntactic parsing for Hebrew","A study that is closely related to ours is (Goldberg and Tsarfaty, 2008), where a single generative model was proposed for joint morphological segmentation and syntactic parsing for Hebrew",'0',"<S sid=""0"">A Single Generative Model for Joint Morphological Segmentation and Syntactic Parsing</S>",
10,P08-1043,D12-1133,0,2008,0,"Models that in addition incorporate morphological analysis and segmentation have been explored by Tsarfaty (2006), Cohen and Smith (2007), and Goldberg and Tsarfaty (2008) with special reference to Hebrew parsing","Models that in addition incorporate morphological analysis and segmentation have been explored by Tsarfaty (2006), Cohen and Smith (2007), and Goldberg and Tsarfaty (2008) with special reference to Hebrew parsing",'108',"<S sid=""108"" ssid=""40"">Secondly, some segments in a proposed segment sequence may in fact be seen lexical events, i.e., for some p tag Prf(p &#8212;* (s, p)) &gt; 0, while other segments have never been observed as a lexical event before.</S>",
11,P08-1043,E09-1038,0,"Goldberg and Tsarfaty, 2008",0,"4), and in a more realistic one in which parsing and segmentation are handled jointly by the parser (Goldberg and Tsarfaty, 2008) (Sec","Parsing and segmentation are handled jointly by the parser (Goldberg and Tsarfaty, 2008)",'5',"<S sid=""5"" ssid=""1"">Current state-of-the-art broad-coverage parsers assume a direct correspondence between the lexical items ingrained in the proposed syntactic analyses (the yields of syntactic parse-trees) and the spacedelimited tokens (henceforth, &#8216;tokens&#8217;) that constitute the unanalyzed surface forms (utterances).</S>",
12,P08-1043,E09-1038,0,"Goldberg and Tsarfaty, 2008",0,"It is the same grammar as described in (Goldberg and Tsarfaty, 2008)","It is the same grammar as described in (Goldberg and Tsarfaty, 2008)",'169',"<S sid=""169"" ssid=""7"">Table 2 compares the performance of our system on the setup of Cohen and Smith (2007) to the best results reported by them for the same tasks.</S>",
14,P08-1043,E09-1038,0,2008,0,"Several studies followed this line, (Cohen and Smith, 2007) the most recent of which is Goldberg and Tsarfaty (2008), who presented a model based on unweighted lattice parsing for performing the joint task","The most recent of which is Goldberg and Tsarfaty (2008), who presented a model based on unweighted lattice parsing for performing the joint task",'0',"<S sid=""0"">A Single Generative Model for Joint Morphological Segmentation and Syntactic Parsing</S>",
15,P08-1043,E09-1038,0,2008,0,Goldberg and Tsarfaty (2008) use a data-driven morphological analyzer derived from the tree bank,Goldberg and Tsarfaty (2008) use a data-driven morphological analyzer derived from the tree bank,'4',"<S sid=""4"" ssid=""4"">Using a treebank grammar, a data-driven lexicon, and a linguistically motivated unknown-tokens handling technique our model outperforms previous pipelined, integrated or factorized systems for Hebrew morphological and syntactic processing, yielding an error reduction of 12% over the best published results so far.</S>",
16,P08-1043,E09-1038,0,2008,0,The model of Goldberg and Tsarfaty (2008) uses a morphological analyzer to constructs a lattice for each input token,The model of Goldberg and Tsarfaty (2008) uses a morphological analyzer to constructs a lattice for each input token,'18',"<S sid=""18"" ssid=""14"">Cohen and Smith (2007) followed up on these results and proposed a system for joint inference of morphological and syntactic structures using factored models each designed and trained on its own.</S>",
17,P08-1043,E09-1038,0,"Goldberg and Tsarfaty, 2008",0,"Instead, we use the evaluation measure of (Tsarfaty, 2006), also used in (Goldberg and Tsarfaty, 2008), which is an adaptation of parse val to use characters instead of space-delimited tokens as its basic units","Instead, we use the evaluation measure of (Tsarfaty, 2006), also used in (Goldberg and Tsarfaty, 2008), which is an adaptation of parseval to use characters instead of space-delimited tokens as its basic units",'10',"<S sid=""10"" ssid=""6"">This token may further embed into a larger utterance, e.g., &#8216;bcl hneim&#8217; (literally &#8220;in-the-shadow the-pleasant&#8221;, meaning roughly &#8220;in the pleasant shadow&#8221;) in which the dominated Noun is modified by a proceeding space-delimited adjective.</S>",
