Citance Number,Reference Article,Citing Article,Citation Marker Offset,Citation Marker,Citation Offset,Citation Text,Citation Text Clean,Reference Offset,Reference Text,Discourse Facet
14,P11-1061,P12-3012,0,"Das and Petrov, 2011",0,"In recent years research in Natural Language Processing (NLP) has been steadily moving towards multilingual processing: the availability of ever growing amounts of text in different languages ,infact, has been a major driving force behind research on multilingual approaches, from morphosyntactic (Das and Petrov, 2011) and syntactico semantic (Peirsman and Pado?, 2010) phenomena to high-end tasks like textual entailment (Mehdad et al., 2011) and sentiment analysis (Lu et al, 2011)","In recent years research in Natural Language Processing (NLP) has been steadily moving towards multilingual processing: the availability of ever growing amounts of text in different languages, in fact, has been a major driving force behind research on multilingual approaches, from morphosyntactic (Das and Petrov, 2011) and syntactico semantic (Peirsman and Pado?, 2010) phenomena to high-end tasks like textual entailment (Mehdad et al., 2011) and sentiment analysis (Lu et al, 2011)","'5','13','59','11','19','8','156','16','10'","<S sid=""5"" ssid=""1"">Supervised learning approaches have advanced the state-of-the-art on a variety of tasks in natural language processing, resulting in highly accurate systems.</S><S sid=""13"" ssid=""9"">(2009) study related but different multilingual grammar and tagger induction tasks, where it is assumed that no labeled data at all is available.</S><S sid=""59"" ssid=""25"">So far the graph has been completely unlabeled.</S><S sid=""11"" ssid=""7"">This scenario is applicable to a large set of languages and has been considered by a number of authors in the past (Alshawi et al., 2000; Xi and Hwa, 2005; Ganchev et al., 2009).</S><S sid=""19"" ssid=""15"">Syntactic universals are a well studied concept in linguistics (Carnie, 2002; Newmeyer, 2005), and were recently used in similar form by Naseem et al. (2010) for multilingual grammar induction.</S><S sid=""8"" ssid=""4"">Unsupervised learning approaches appear to be a natural solution to this problem, as they require only unannotated text for training models.</S><S sid=""156"" ssid=""19"">As Figure 1 shows, this word has no high-confidence alignment in the Italian-English bitext.</S><S sid=""16"" ssid=""12"">To this end, we construct a bilingual graph over word types to establish a connection between the two languages (&#167;3), and then use graph label propagation to project syntactic information from English to the foreign language (&#167;4).</S><S sid=""10"" ssid=""6"">To bridge this gap, we consider a practically motivated scenario, in which we want to leverage existing resources from a resource-rich language (like English) when building tools for resource-poor foreign languages.1 We assume that absolutely no labeled training data is available for the foreign language of interest, but that we have access to parallel data with a resource-rich language.</S>",
15,P11-1061,D11-1006,0,2011,0,"Furthermore, we evaluate with both gold-standard part-of-speech tags, as well as predicted part-of speech tags from the projected part-of-speech tagger of Das and Petrov (2011) .2 This tagger relies only onlabeled training data for English, and achieves accuracies around 85% on the languages that we con sider","Furthermore, we evaluate with both gold-standard part-of-speech tags, as well as predicted part-of speech tags from the projected part-of-speech tagger of Das and Petrov (2011). This tagger relies only on labeled training data for English, and achieves accuracies around 85% on the languages that we consider","'1','18','0','158','6','112','10','29','45'","<S sid=""1"" ssid=""1"">We describe a novel approach for inducing unsupervised part-of-speech taggers for languages that have no labeled training data, but have translated text in a resource-rich language.</S><S sid=""18"" ssid=""14"">To make the projection practical, we rely on the twelve universal part-of-speech tags of Petrov et al. (2011).</S><S sid=""0"">Unsupervised Part-of-Speech Tagging with Bilingual Graph-Based Projections</S><S sid=""158"" ssid=""1"">We have shown the efficacy of graph-based label propagation for projecting part-of-speech information across languages.</S><S sid=""6"" ssid=""2"">Supervised part-of-speech (POS) taggers, for example, approach the level of inter-annotator agreement (Shen et al., 2007, 97.3% accuracy for English).</S><S sid=""112"" ssid=""12"">While there might be some controversy about the exact definition of such a tagset, these 12 categories cover the most frequent part-of-speech and exist in one form or another in all of the languages that we studied.</S><S sid=""10"" ssid=""6"">To bridge this gap, we consider a practically motivated scenario, in which we want to leverage existing resources from a resource-rich language (like English) when building tools for resource-poor foreign languages.1 We assume that absolutely no labeled training data is available for the foreign language of interest, but that we have access to parallel data with a resource-rich language.</S><S sid=""29"" ssid=""6"">To establish a soft correspondence between the two languages, we use a second similarity function, which leverages standard unsupervised word alignment statistics (&#167;3.3).3 Since we have no labeled foreign data, our goal is to project syntactic information from the English side to the foreign side.</S><S sid=""45"" ssid=""11"">Furthermore, we do not connect the English vertices to each other, but only to foreign language vertices.4 The graph vertices are extracted from the different sides of a parallel corpus (De, Df) and an additional unlabeled monolingual foreign corpus Ff, which will be used later for training.</S>",
16,P11-1061,D11-1006,0,2011,0,"In the first, we assumed that the test set for each target language had gold part-of-speech tags, and in the second we used predicted part-of-speech tags from the projection tagger of Das and Petrov (2011), which also uses English as the source language","In the first, we assumed that the test set for each target language had gold part-of-speech tags, and in the second we used predicted part-of-speech tags from the projection tagger of Das and Petrov (2011), which also uses English as the source language","'18','0','1','158','6','153','41'","<S sid=""18"" ssid=""14"">To make the projection practical, we rely on the twelve universal part-of-speech tags of Petrov et al. (2011).</S><S sid=""0"">Unsupervised Part-of-Speech Tagging with Bilingual Graph-Based Projections</S><S sid=""1"" ssid=""1"">We describe a novel approach for inducing unsupervised part-of-speech taggers for languages that have no labeled training data, but have translated text in a resource-rich language.</S><S sid=""158"" ssid=""1"">We have shown the efficacy of graph-based label propagation for projecting part-of-speech information across languages.</S><S sid=""6"" ssid=""2"">Supervised part-of-speech (POS) taggers, for example, approach the level of inter-annotator agreement (Shen et al., 2007, 97.3% accuracy for English).</S><S sid=""153"" ssid=""16"">Figure 2 shows an excerpt of a sentence from the Italian test set and the tags assigned by four different models, as well as the gold tags.</S><S sid=""41"" ssid=""7"">Because the information flow in our graph is asymmetric (from English to the foreign language), we use different types of vertices for each language.</S>",
17,P11-1061,P13-2112,0,2011,0,"This parallel data can be exploited to bridge languages, and in particular, transfer information from a highly-resourced language to a lesser-resourced language, to build unsupervised POS taggers. In this paper, we propose an unsupervised approach to POS tagging in a similar vein to the work of Das and Petrov (2011)","This parallel data can be exploited to bridge languages, and in particular, transfer information from a highly-resourced language to a lesser-resourced language, to build unsupervised POS taggers. In this paper, we propose an unsupervised approach to POS tagging in a similar vein to the work of Das and Petrov (2011)","'1','24','10','161','160','21','29','84'","<S sid=""1"" ssid=""1"">We describe a novel approach for inducing unsupervised part-of-speech taggers for languages that have no labeled training data, but have translated text in a resource-rich language.</S><S sid=""24"" ssid=""1"">The focus of this work is on building POS taggers for foreign languages, assuming that we have an English POS tagger and some parallel text between the two languages.</S><S sid=""10"" ssid=""6"">To bridge this gap, we consider a practically motivated scenario, in which we want to leverage existing resources from a resource-rich language (like English) when building tools for resource-poor foreign languages.1 We assume that absolutely no labeled training data is available for the foreign language of interest, but that we have access to parallel data with a resource-rich language.</S><S sid=""161"" ssid=""4"">Our results outperform strong unsupervised baselines as well as approaches that rely on direct projections, and bridge the gap between purely supervised and unsupervised POS tagging models.</S><S sid=""160"" ssid=""3"">Our results suggest that it is possible to learn accurate POS taggers for languages which do not have any annotated data, but have translations into a resource-rich language.</S><S sid=""21"" ssid=""17"">These universal POS categories not only facilitate the transfer of POS information from one language to another, but also relieve us from using controversial evaluation metrics,2 by establishing a direct correspondence between the induced hidden states in the foreign language and the observed English labels.</S><S sid=""29"" ssid=""6"">To establish a soft correspondence between the two languages, we use a second similarity function, which leverages standard unsupervised word alignment statistics (&#167;3.3).3 Since we have no labeled foreign data, our goal is to project syntactic information from the English side to the foreign side.</S><S sid=""84"" ssid=""15"">This vector tx is constructed for every word in the foreign vocabulary and will be used to provide features for the unsupervised foreign language POS tagger.</S>",
18,P11-1061,P13-2112,0,2011,0,Das and Petrov (2011) achieved the current state-of-the-art for unsupervised tagging by exploiting high confidence alignments to copy tags from the source language to the target language,Das and Petrov (2011) achieved the current state-of-the-art for unsupervised tagging by exploiting high confidence alignments to copy tags from the source language to the target language,"'23','5','2','57','56','156'","<S sid=""23"" ssid=""19"">Our final average POS tagging accuracy of 83.4% compares very favorably to the average accuracy of Berg-Kirkpatrick et al.&#8217;s monolingual unsupervised state-of-the-art model (73.0%), and considerably bridges the gap to fully supervised POS tagging performance (96.6%).</S><S sid=""5"" ssid=""1"">Supervised learning approaches have advanced the state-of-the-art on a variety of tasks in natural language processing, resulting in highly accurate systems.</S><S sid=""2"" ssid=""2"">Our method does not assume any knowledge about the target language (in particular no tagging dictionary is assumed), making it applicable to a wide array of resource-poor languages.</S><S sid=""57"" ssid=""23"">Since our graph is built from a parallel corpus, we can use standard word alignment techniques to align the English sentences De 5Note that many combinations are impossible giving a PMI value of 0; e.g., when the trigram type and the feature instantiation don&#8217;t have words in common. and their foreign language translations Df.6 Label propagation in the graph will provide coverage and high recall, and we therefore extract only intersected high-confidence (&gt; 0.9) alignments De&#65533;f.</S><S sid=""56"" ssid=""22"">To define a similarity function between the English and the foreign vertices, we rely on high-confidence word alignments.</S><S sid=""156"" ssid=""19"">As Figure 1 shows, this word has no high-confidence alignment in the Italian-English bitext.</S>",
19,P11-1061,P13-2112,0,"Das and Petrov, 2011",0,"We have proposed a method for unsupervised POStagging that performs on par with the current state of-the-art (Das and Petrov, 2011), but is subs tan tially less-sophisticated (specifically not requiring convex optimization or a feature-based HMM)","We have proposed a method for unsupervised POS tagging that performs on par with the current state of-the-art (Das and Petrov, 2011), but is substantially less-sophisticated (specifically not requiring convex optimization or a feature-based HMM)","'23','93','147','5','94','85','0','99'","<S sid=""23"" ssid=""19"">Our final average POS tagging accuracy of 83.4% compares very favorably to the average accuracy of Berg-Kirkpatrick et al.&#8217;s monolingual unsupervised state-of-the-art model (73.0%), and considerably bridges the gap to fully supervised POS tagging performance (96.6%).</S><S sid=""93"" ssid=""24"">For English POS tagging, BergKirkpatrick et al. (2010) found that this direct gradient method performed better (&gt;7% absolute accuracy) than using a feature-enhanced modification of the Expectation-Maximization (EM) algorithm (Dempster et al., 1977).8 Moreover, this route of optimization outperformed a vanilla HMM trained with EM by 12%.</S><S sid=""147"" ssid=""10"">As indicated by bolding, for seven out of eight languages the improvements of the &#8220;With LP&#8221; setting are statistically significant with respect to the other models, including the &#8220;No LP&#8221; setting.11 Overall, it performs 10.4% better than the hitherto state-of-the-art feature-HMM baseline, and 4.6% better than direct projection, when we macro-average the accuracy over all languages.</S><S sid=""5"" ssid=""1"">Supervised learning approaches have advanced the state-of-the-art on a variety of tasks in natural language processing, resulting in highly accurate systems.</S><S sid=""94"" ssid=""25"">We adopted this state-of-the-art model because it makes it easy to experiment with various ways of incorporating our novel constraint feature into the log-linear emission model.</S><S sid=""85"" ssid=""16"">We develop our POS induction model based on the feature-based HMM of Berg-Kirkpatrick et al. (2010).</S><S sid=""0"">Unsupervised Part-of-Speech Tagging with Bilingual Graph-Based Projections</S><S sid=""99"" ssid=""30"">It would have therefore also been possible to use the integer programming (IP) based approach of Ravi and Knight (2009) instead of the feature-HMM for POS induction on the foreign side.</S>",
