Citance Number,Reference Article,Citing Article,Citation Marker Offset,Citation Marker,Citation Offset,Citation Text,Citation Text Clean,Reference Offset,Reference Text,Discourse Facet
1,P04-1036,W04-0837,0,"McCarthy et al, 2004",0,"The first sense heuristic which is often used as a baseline for supervised WSD systems outperforms many of these systems which take surrounding con text into account (McCarthy et al, 2004)","The first sense heuristic which is often used as a baseline for supervised WSD systems outperforms many of these systems which take surrounding context into account (McCarthy et al, 2004)","'8','14','2','107','48','108'","<S sid=""8"" ssid=""1"">The first sense heuristic which is often used as a baseline for supervised WSD systems outperforms many of these systems which take surrounding context into account.</S><S sid=""14"" ssid=""7"">Even systems which show superior performance to this heuristic often make use of the heuristic where evidence from the context is not sufficient (Hoste et al., 2001).</S><S sid=""2"" ssid=""2"">The problem with using the predominant, or first sense heuristic, aside from the fact that it does not take surrounding context into account, is that it assumes some quantity of handtagged data.</S><S sid=""107"" ssid=""5"">To disambiguate senses a system should take context into account.</S><S sid=""48"" ssid=""4"">To find the first sense of a word ( ) we take each sense in turn and obtain a score reflecting the prevalence which is used for ranking.</S><S sid=""108"" ssid=""6"">However, it is important to know the performance of this heuristic for any systems that use it.</S>","['hypothesis_citation','results_citation']"
2,P04-1036,W04-0837,0,"McCarthy et al, 2004",0,"Association for Computational Linguistics for the Semantic Analysis of Text, Barcelona, Spain, July 2004 SENSEVAL-3: Third International Workshop on the Evaluation of Systems PoS precision recall baseline Noun 95 73 45 Verb 79 43 22 Adjective 88 59 44 Adverb 91 72 59 All PoS 90 63 41Table 2: The SENSEVAL-2 first sense on the SEN SEVAL-2 English all-words data system can be tuned to a given genre or domain (McCarthy et al, 2004) and also because there will be words that occur with insufficient frequency inthe hand-tagged resources available","Whilst a first sense heuristic based on a sense-tagged corpus such as SemCor is clearly useful, there is a case for obtaining a first, or predominant, sense from untagged corpus data so that a WSD system can be tuned to a given genre or domain (McCarthy et al., 2004) and also because there will be words that occur with insufficient frequency in the hand-tagged resources available","'15','3','154','17','10'","<S sid=""15"" ssid=""8"">Whilst a first sense heuristic based on a sense-tagged corpus such as SemCor is clearly useful, there is a strong case for obtaining a first, or predominant, sense from untagged corpus data so that a WSD system can be tuned to the genre or domain at hand.</S><S sid=""3"" ssid=""3"">Whilst there are a few hand-tagged corpora available for some languages, one would expect the frequency distribution of the senses of words, particularly topical words, to depend on the genre and domain of the text under consideration.</S><S sid=""154"" ssid=""2"">In contrast, our work is aimed at discovering the predominant senses from raw text because the first sense heuristic is such a useful one, and because handtagged data is not always available.</S><S sid=""17"" ssid=""10"">There are words where the first sense in WordNet is counter-intuitive, because of the size of the corpus, and because where the frequency data does not indicate a first sense, the ordering is arbitrary.</S><S sid=""10"" ssid=""3"">The senses in WordNet are ordered according to the frequency data in the manually tagged resource SemCor (Miller et al., 1993).</S>",['method_citation']
3,P04-1036,W04-0837,0,"McCarthy et al, 2004",0,"The method is described in (McCarthy et al, 2004), which we summarise here","The method is described in (McCarthy et al, 2004), which we summarise here",'64',"<S sid=""64"" ssid=""20"">We briefly summarise the two measures here; for a more detailed summary see (Patwardhan et al., 2003).</S>",['method_citation']
5,P04-1036,I08-2105,0,"McCarthy et al, 2004",0,"McCarthy et al (2004) use a corpus and word similarities to induce a ranking of word senses from an untagged corpus to be used in WSD.We build upon this previous research, and pro pose an unsupervised WSD method in which senses for two grammatically related words in the sentence will be connected through directed edges",McCarthy et al (2004) use a corpus and word similarities to induce a ranking of word senses from an untagged corpus to be used in WSD,"'165','0'","<S sid=""165"" ssid=""13"">Lapata and Brew obtain their priors for verb classes directly from subcategorisation evidence in a parsed corpus, whereas we use parsed data to find distributionally similar words (nearest neighbours) to the target word which reflect the different senses of the word and have associated distributional similarity scores which can be used for ranking the senses according to prevalence.</S><S sid=""0"">Finding Predominant Word Senses in Untagged Text</S>",['hypothesis_citation']
6,P04-1036,I08-2105,0,"McCarthy et al, 2004",0,"Previous re search in inducing sense rankings from an untagged corpus (McCarthy et al, 2004), and inducing selectional preferences at the word level (for other applications) (Erk, 2007) will provide the starting point for research in this direction","Previous research in inducing sense rankings from an untagged corpus (McCarthy et al, 2004), and inducing selectional preferences at the word level (for other applications) (Erk, 2007) will provide the starting point for research in this direction","'0','175'","<S sid=""0"">Finding Predominant Word Senses in Untagged Text</S><S sid=""175"" ssid=""23"">We are currently investigating the performance of the first sense heuristic, and this method, for other PoS on SENSEVAL-3 data (McCarthy et al., 2004), although not yet with rankings from domain specific corpora.</S>","['method_citation','results_citation']"
7,P04-1036,I08-2105,0,2004,0,"McCarthy et al (2004) report a disambiguation precision of 53.0% and recall of 49.0% on the Senseval-2 test data, using an approach that derives sense ranking based on word similarity and distributional analysis in a corpus","McCarthy et al (2004) report a disambiguation precision of 53.0% and recall of 49.0% on the Senseval-2 test data, using an approach that derives sense ranking based on word similarity and distributional analysis in a corpus",'61',"<S sid=""61"" ssid=""17"">We use the WordNet Similarity Package 0.05 and WordNet version 1.6.</S>",['method_citation']
8,P04-1036,P06-1012,0,"McCarthy et al, 2004",0,"Research by (McCarthy et al, 2004) highlighted that the sense priors of a word in a corpus depend on the domain from which the corpus is drawn","Research by (McCarthy et al, 2004) highlighted that the sense priors of a word in a corpus depend on the domain from which the corpus is drawn",'33',"<S sid=""33"" ssid=""26"">Many researchers are developing thesauruses from automatically parsed data.</S>",['method_citation']
9,P04-1036,P06-1012,0,"McCarthy et al, 2004",0,"In addition, we implemented the unsupervised method of (McCarthy et al, 2004), which cal cu lates a prevalence score for each sense of a word to predict the predominant sense","In addition, we implemented the unsupervised method of (McCarthy et al, 2004), which calculates a prevalence score for each sense of a word to predict the predominant sense","'48','81'","<S sid=""48"" ssid=""4"">To find the first sense of a word ( ) we take each sense in turn and obtain a score reflecting the prevalence which is used for ranking.</S><S sid=""81"" ssid=""10"">4 We calculate the accuracy of finding the predominant sense, when there is indeed one sense with a higher frequency than the others for this word in SemCor ( ).</S>",['method_citation']
11,P04-1036,P10-1155,0,2004,0,"McCarthy et al (2004) reported that the best results were obtained using k= 50 neighbors and the Wordnet Similarityjcn measure (Jiang and Conrath, 1997)","McCarthy et al (2004) reported that the best results were obtained using k= 50 neighbors and the Wordnet Similarity jcn measure (Jiang and Conrath, 1997)","'79','63','179'","<S sid=""79"" ssid=""8"">3 The experimental results reported here are obtained using IC counts from the BNC corpus.</S><S sid=""63"" ssid=""19"">We experimented using six of these to provide the in equation 1 above and obtained results well over our baseline, but because of space limitations give results for the two which perform the best.</S><S sid=""179"" ssid=""2"">We use an automatically acquired thesaurus and a WordNet Similarity measure.</S>",['method_citation']
12,P04-1036,W12-3401,0,2004,0,"In doing so, we provide first results on the application to French parsing of WordNet automatic sense ranking (ASR), using the method of McCarthy et al (2004)","In doing so, we provide first results on the application to French parsing of WordNet automatic sense ranking (ASR), using the method of McCarthy et al (2004)",'175',"<S sid=""175"" ssid=""23"">We are currently investigating the performance of the first sense heuristic, and this method, for other PoS on SENSEVAL-3 data (McCarthy et al., 2004), although not yet with rankings from domain specific corpora.</S>","['method_citation','results_citation']"
13,P04-1036,W12-3401,0,2004,0,"To define an appropriate categorical distribution over synsets for each 2 lemma x in our source vocabulary, we first use the WordNet resource to identify the set Sx of different senses of x. We then use a distributional thesaurus to perform ASR, which determines the prevalence with respect to x of each sense s? Sx, following the approach of McCarthy et al (2004)","We then use a distributional thesaurus to perform ASR, which determines the prevalence with respect to x of each senses' Sx, following the approach of McCarthy et al (2004)",'188',"<S sid=""188"" ssid=""11"">We want to investigate the effect of frequency and choice of distributional similarity measure (Weeds et al., 2004).</S>",['method_citation']
14,P04-1036,W12-3401,0,2004,0,"As explained in Section 2.2, ASR is performed using the method of McCarthy et al (2004)","As explained in Section 2.2, ASR is performed using the method of McCarthy et al (2004)","'133','29','175'","<S sid=""133"" ssid=""10"">We acquired thesauruses for these corpora using the procedure described in section 2.1.</S><S sid=""29"" ssid=""22"">We discuss our method in the following section.</S><S sid=""175"" ssid=""23"">We are currently investigating the performance of the first sense heuristic, and this method, for other PoS on SENSEVAL-3 data (McCarthy et al., 2004), although not yet with rankings from domain specific corpora.</S>","['method_citation','results_citation']"
16,P04-1036,S12-1097,0,"McCarthy et al, 2004",0,"This approach is commonly used as a baseline for word sense disambiguation (McCarthy et al, 2004)","This approach is commonly used as a baseline for word sense disambiguation (McCarthy et al, 2004)","'1','8','48'","<S sid=""1"" ssid=""1"">word sense disambiguation the heuristic of choosing the most common sense is extremely powerful because the distribution of the senses of a word is often skewed.</S><S sid=""8"" ssid=""1"">The first sense heuristic which is often used as a baseline for supervised WSD systems outperforms many of these systems which take surrounding context into account.</S><S sid=""48"" ssid=""4"">To find the first sense of a word ( ) we take each sense in turn and obtain a score reflecting the prevalence which is used for ranking.</S>",['method_citation']
17,P04-1036,W10-2803,0,"McCarthy et al, 2004",0,"More radical solutions than sense grouping that have been proposed are to restrict the task to determining predominant sense in a given domain (McCarthy et al, 2004), or to work directly with para phrases (McCarthy and Navigli, 2009)","More radical solutions than sense grouping that have been proposed are to restrict the task to determining predominant sense in a given domain (McCarthy et al, 2004), or to work directly with para phrases (McCarthy and Navigli, 2009)",'166',"<S sid=""166"" ssid=""14"">There has been some related work on using automatic thesauruses for discovering word senses from corpora Pantel and Lin (2002).</S>",['method_citation']
18,P04-1036,W08-2107,0,2004,0,"In addition, we can also infer a positive contribution of the frequency of a sense with the choice of the first synset returned by Word net resulting in a reasonable WSD heuristic (which is compatible with the results by McCarthy et al (2004))","In addition, we can also infer a positive contribution of the frequency of a sense with the choice of the first synset returned by Word net resulting in a reasonable WSD heuristic (which is compatible with the results by McCarthy et al (2004))",'188',"<S sid=""188"" ssid=""11"">We want to investigate the effect of frequency and choice of distributional similarity measure (Weeds et al., 2004).</S>",['method_citation']
19,P04-1036,D07-1026,0,"McCarthy et al, 2004",0,"It is worthwhile to remark here that, being the IBLE algorithm fully unsupervised, improving the most frequent baseline is an excellent result, rarely achieved in the literature on unsupervised methods for WSD (McCarthy et al, 2004)","It is worthwhile to remark here that, being the IBLE algorithm fully unsupervised, improving the most frequent baseline is an excellent result, rarely achieved in the literature on unsupervised methods for WSD (McCarthy et al, 2004)",'153',"<S sid=""153"" ssid=""1"">Most research in WSD concentrates on using contextual features, typically neighbouring words, to help determine the correct sense of a target word.</S>",['method_citation']
20,P04-1036,W12-2429,0,"McCarthy et al, 2004",0,"The first, most frequent sense (MFS) (McCarthy et al, 2004), is widely used baseline for supervised WSD systems","The first, most frequent sense (MFS) (McCarthy et al, 2004), is widely used baseline for supervised WSD systems",'8',"<S sid=""8"" ssid=""1"">The first sense heuristic which is often used as a baseline for supervised WSD systems outperforms many of these systems which take surrounding context into account.</S>",['method_citation']
